{"schema_version":"digest.v2","user_id":"usr_demo0001","device_id":"dev_demo0001","generated_at":"2026-08-01T09:14:00Z","synced_through":"2026-08-01T09:10:00Z","corpus":{"message_count":1,"thread_count":1,"span_days":1,"health":"healthy","as_of":"2026-08-01T09:10:00Z"},"relationships":[{"contact_id":"h_8f21a4c0","display":"Maya","is_group":false,"message_count":2,"sent_count":1,"received_count":1,"days_since_last_contact":2,"momentum_90d":1,"initiation_ratio":0.5,"last_from_me":false,"max_gap_days":2,"unanswered_question":true,"facts":{"dates":[],"times":[],"places":[],"amounts":[],"names":[]},"as_of":"2026-08-01T09:10:00Z","understanding":{"register":"warm","relationship_kind":"close_friend","open_thread":"asked whether you are coming, unanswered","last_exchange_shape":"question_from_them","topics":["climbing"],"cadence_norm":"usually replies within an hour; two days is unusual","voice_exemplars":[{"text":"yes im down what time were u thinking","answered":"question_from_them","register":"warm"}]}}],"whole_life":{"as_of":"2026-08-01T09:10:00Z"}}
